{
  "meta": {
    "sop_id": "SOP-004",
    "title": "Delivery Date Rules for Transit Time",
    "version": "1.0",
    "theme": "default"
  },
  "lanes": [
    { "id": "global_log", "label": "Global Logistics" },
    { "id": "vendor", "label": "Vendor" },
    { "id": "agent", "label": "Booking Agent (Forwarder)" },
    { "id": "market", "label": "Market Logistics" }
  ],
  "nodes": [
    { "id": "start", "lane": "global_log", "type": "start", "label": "PO cycle starts" },
    { "id": "n1", "lane": "global_log", "type": "subprocess", "label": "Maintain ERP Transit Time Table", "step": "1",
      "note": "Cadence: per request. Feeds the Promised Date. Tool: ERP." },
    { "id": "n2", "lane": "global_log", "type": "subprocess", "label": "Maintain Forwarder Transit Time Table", "step": "2",
      "note": "Cadence: per request. Feeds the Shipment ASN Expected Receipt Date. Consulted: Booking Agent. Tool: Supplier Portal." },
    { "id": "n3", "lane": "vendor", "type": "task", "label": "Update production end date on PO", "step": "3",
      "note": "The latest confirmed production end date. Tool: Supplier Portal." },
    { "id": "n4", "lane": "vendor", "type": "task", "label": "Update Supplier Ex-Factory Date", "step": "4",
      "note": "Some markets derive it automatically from the production end date plus a fixed lead time; in the others the vendor updates it manually on the PO." },
    { "id": "n5", "lane": "global_log", "type": "task", "label": "ERP auto-calculates Promised Date", "step": "5",
      "note": "Promised Date = Supplier Ex-Factory Date + pre-carriage days + ERP transit time + goods-receipt days, for all ship modes." },
    { "id": "n6", "lane": "vendor", "type": "task", "label": "Enter actual Ex-Factory Date in Packing List", "step": "6",
      "note": "Source document banner before this step: from here on, the Supplier Ex-Factory Date comes from the actual date in the Packing List. The date flows from the Supplier Portal to the ERP purchase order, and the ERP recalculates the Promised Date." },
    { "id": "n7", "lane": "vendor", "type": "decision", "label": "Invoice status = Active?", "step": "7",
      "note": "Entered when the vendor typed a wrong Supplier Ex-Factory Date in the Packing List. The source table documents only the two correction branches; it draws no route for the case where the date is correct, so that path is absent here too. This step and its two branches restate exception scenario 1 ('Key date wrong after invoice generation') as normal flow." },
    { "id": "n7a", "lane": "vendor", "type": "task", "label": "Reopen Packing List and correct the date", "step": "7a",
      "note": "Cadence: per exception — exception scenario 1. Invoice status is not 'Active', so the Packing List stays editable." },
    { "id": "n7b", "lane": "vendor", "type": "task", "label": "Wait for Shipment ASN Expected Receipt Date", "step": "7b",
      "note": "Cadence: per exception — exception scenario 1. Invoice status is 'Active', so the Packing List is locked and the key date cannot be corrected there." },
    { "id": "n8", "lane": "global_log", "type": "decision", "label": "Ship Mode = Ocean?", "step": "8",
      "note": "Source document banner before this step: from here on, stop following the Promised Date and start following the Expected Receipt Date. Once the shipment is on board, the Expected Receipt Date flows from the Shipment ASN and its source depends on the ship mode." },
    { "id": "n8a", "lane": "agent", "type": "task", "label": "Send Shipping Advice to Supplier Portal", "step": "8a",
      "note": "Ocean. The Supplier Portal populates the Shipment ASN Expected Receipt Date as the ETA at the port of discharge plus the forwarder's transit time from the port to the DC. Accountable: Global Logistics. Consulted: Vendor." },
    { "id": "n8b", "lane": "vendor", "type": "task", "label": "Flip Packing List to Shipment ASN using ETA", "step": "8b",
      "note": "Air, Truck, Parcel: no Shipping Advice is sent; the Supplier Portal converts the Packing List into the Shipment ASN and the Expected Receipt Date is taken from the Packing List ETA — at the destination airport for Air, at the destination DC for Truck and Parcel. Accountable: Global Logistics." },
    { "id": "n9", "lane": "global_log", "type": "decision", "label": "New date outside the tolerance window?", "step": "9",
      "note": "Recalculated for all markets when the new value differs from the current value by more than the agreed tolerance. Tool: ERP." },
    { "id": "n10a", "lane": "global_log", "type": "task", "label": "Keep Expected Receipt Date", "step": "10a",
      "note": "Change within the tolerance, so the Expected Receipt Date is not updated." },
    { "id": "n10b", "lane": "global_log", "type": "task", "label": "Update Expected Receipt Date", "step": "10b",
      "note": "Change outside the tolerance, so the Expected Receipt Date is updated." },
    { "id": "n11", "lane": "market", "type": "task", "label": "Record Actual Receipt Date", "step": "11",
      "note": "Goods receipt date on receipt at destination. Informed: Market Finance. Tool: ERP." },
    { "id": "end", "lane": "market", "type": "end", "label": "Key dates closed" }
  ],
  "edges": [
    { "from": "start", "to": "n1" },
    { "from": "n1", "to": "n2", "channel": "user" },
    { "from": "n2", "to": "n3" },
    { "from": "n3", "to": "n4", "channel": "user" },
    { "from": "n4", "to": "n5", "channel": "system" },
    { "from": "n5", "to": "n6" },
    { "from": "n6", "to": "n7", "channel": "user" },
    { "from": "n7", "to": "n7a", "label": "No", "channel": "user" },
    { "from": "n7", "to": "n7b", "label": "Yes", "channel": "user" },
    { "from": "n7a", "to": "n8", "channel": "user" },
    { "from": "n7b", "to": "n8", "channel": "system" },
    { "from": "n8", "to": "n8a", "label": "Yes", "channel": "system" },
    { "from": "n8", "to": "n8b", "label": "No", "channel": "system" },
    { "from": "n8a", "to": "n9", "channel": "system" },
    { "from": "n8b", "to": "n9", "channel": "system" },
    { "from": "n9", "to": "n10a", "label": "No", "channel": "system" },
    { "from": "n9", "to": "n10b", "label": "Yes", "channel": "system" },
    { "from": "n10a", "to": "n11" },
    { "from": "n10b", "to": "n11", "channel": "system" },
    { "from": "n11", "to": "end" }
  ]
}
