{
  "meta": {
    "sop_id": "SOP-002",
    "title": "Booking Cancellation and Amendment",
    "version": "1.0",
    "theme": "default"
  },
  "lanes": [
    { "id": "vendor", "label": "Vendor/Factory" },
    { "id": "portal", "label": "Supplier Portal" },
    { "id": "agent", "label": "Booking Agent" },
    { "id": "specialist", "label": "Specialist Team" }
  ],
  "nodes": [
    { "id": "start", "lane": "vendor", "type": "start", "label": "Booking change needed" },
    { "id": "n1", "lane": "vendor", "type": "task", "label": "Search vendor booking", "step": "1" },
    { "id": "n2", "lane": "portal", "type": "document", "label": "Vendor Booking status check", "step": "2" },
    { "id": "n3", "lane": "portal", "type": "decision", "label": "Status = Accepted?", "step": "3" },
    { "id": "n3a", "lane": "vendor", "type": "task", "label": "Reopen or cancel booking request", "step": "3a",
      "note": "Reached whenever the booking is not one the vendor may change offline: Truck or Parcel on any incoterm other than EXW (step 4a), and Ocean or Air on CIF, DDP or DAP (step 4b). Also the entry point when the Vendor Booking status is not Accepted (step 3)." },
    { "id": "n3b", "lane": "vendor", "type": "task", "label": "Offline contact Booking Agent", "step": "3b" },
    { "id": "n4", "lane": "vendor", "type": "decision", "label": "Check ship mode", "step": "4" },
    { "id": "n4a", "lane": "vendor", "type": "decision", "label": "Check incoterm (Truck/Parcel)", "step": "4a" },
    { "id": "n4b", "lane": "vendor", "type": "decision", "label": "Check incoterm (Ocean/Air)", "step": "4b" },
    { "id": "n5", "lane": "specialist", "type": "task", "label": "Offline contact Specialist Team", "step": "5" },
    { "id": "n6", "lane": "specialist", "type": "decision", "label": "Booking can be cancelled?", "step": "6" },
    { "id": "n7", "lane": "agent", "type": "task", "label": "Offline contact Booking Agent", "step": "7" },
    { "id": "n8", "lane": "agent", "type": "decision", "label": "Booking can be cancelled?", "step": "8" },
    { "id": "n9", "lane": "vendor", "type": "task", "label": "Receive no-change notice", "step": "9",
      "note": "The booking cannot be cancelled, so the Specialist Team (step 6) or the Booking Agent (step 8) informs the vendor with the reason and the booking stands." },
    { "id": "n10", "lane": "portal", "type": "document", "label": "Vendor Booking reject", "step": "10",
      "note": "The booking can be cancelled, so the Specialist Team (step 6) or the Booking Agent (step 8) rejects the Vendor Booking in the Supplier Portal." },
    { "id": "n11", "lane": "vendor", "type": "decision", "label": "Amendment or cancellation?", "step": "11" },
    { "id": "n11a", "lane": "portal", "type": "document", "label": "Vendor Booking amendment", "step": "11a" },
    { "id": "n11b", "lane": "portal", "type": "document", "label": "Vendor Booking cancel", "step": "11b" },
    { "id": "end", "lane": "portal", "type": "end", "label": "Booking updated" }
  ],
  "edges": [
    { "from": "start", "to": "n1" },
    { "from": "n1", "to": "n2", "channel": "user" },
    { "from": "n2", "to": "n3", "channel": "system" },
    { "from": "n3", "to": "n3a", "label": "No", "channel": "user" },
    { "from": "n3", "to": "n3b", "label": "Yes", "channel": "user" },
    { "from": "n3b", "to": "n4", "channel": "system" },
    { "from": "n4", "to": "n4a", "label": "Truck/Parcel" },
    { "from": "n4", "to": "n4b", "label": "Ocean/Air", "channel": "system" },
    { "from": "n4a", "to": "n5", "label": "Truck EXW" },
    { "from": "n4a", "to": "n3a", "label": "Other incoterm", "channel": "system" },
    { "from": "n4b", "to": "n7", "label": "EXW/FOB" },
    { "from": "n4b", "to": "n3a", "label": "CIF/DDP/DAP", "channel": "user" },
    { "from": "n5", "to": "n6", "channel": "user" },
    { "from": "n7", "to": "n8", "channel": "user" },
    { "from": "n6", "to": "n9", "label": "No" },
    { "from": "n6", "to": "n10", "label": "Yes", "channel": "user" },
    { "from": "n8", "to": "n9", "label": "No" },
    { "from": "n8", "to": "n10", "label": "Yes", "channel": "user" },
    { "from": "n10", "to": "n3a", "channel": "user" },
    { "from": "n9", "to": "end" },
    { "from": "n3a", "to": "n11", "channel": "system" },
    { "from": "n11", "to": "n11a", "label": "Booking amendment", "channel": "user" },
    { "from": "n11", "to": "n11b", "label": "Booking cancel", "channel": "user" },
    { "from": "n11a", "to": "end" },
    { "from": "n11b", "to": "end" }
  ]
}
